{
  "schema_version": "v0.1",
  "tool_id": "flat_spatula",
  "tool_frame": "tool",
  "functional_parts": {
    "part_000_x_negative_endpoint": {
      "role": "endpoint_contact_patch",
      "center": {
        "xyz_tool": [
          -0.10287006350418954,
          0.001060092121177842,
          0.0006896512734415482
        ]
      },
      "normal": {
        "vector_tool": [
          -0.9986233791502664,
          -0.02989473040193537,
          -0.04310048385689759
        ]
      },
      "axis": {
        "vector_tool": [
          0.052453280302596744,
          -0.5691460385421753,
          -0.8205616614229827
        ]
      },
      "frame": {
        "origin": [
          -0.10287006350418954,
          0.001060092121177842,
          0.0006896512734415482
        ],
        "x_axis": [
          0.052453280302596744,
          -0.5691460385421753,
          -0.8205616614229827
        ],
        "y_axis": [
          0.0,
          -0.8216928208922994,
          0.5699306169123183
        ],
        "z_axis": [
          -0.9986233791502666,
          -0.029894730401935375,
          -0.043100483856897596
        ]
      },
      "T_tool_functional": [
        [
          0.052453280302596744,
          0.0,
          -0.9986233791502666,
          -0.10287006350418954
        ],
        [
          -0.5691460385421753,
          -0.8216928208922994,
          -0.029894730401935375,
          0.001060092121177842
        ],
        [
          -0.8205616614229827,
          0.5699306169123183,
          -0.043100483856897596,
          0.0006896512734415482
        ],
        [
          0.0,
          0.0,
          0.0,
          1.0
        ]
      ],
      "confidence": 0.8909614223188782,
      "source": "p3sam_tool_prior",
      "provenance": {
        "observation_id": "flat_spatula_p3sam_typed_contact_refs",
        "method": "p3sam_face_label_adapter",
        "source_artifact": "artifacts/tool_prior/p3sam/flat_spatula/face_labels/p3sam_face_labels.npy",
        "part_label": 0,
        "patch_id": "x_negative_endpoint",
        "connected_component_index": 0,
        "connected_component_count": 16,
        "original_face_count": 1159,
        "kept_face_count": 1159,
        "removed_disconnected_face_count": 0
      }
    },
    "part_000_x_positive_endpoint": {
      "role": "endpoint_contact_patch",
      "center": {
        "xyz_tool": [
          0.0821974187326482,
          -0.003091063257343436,
          0.003020717008126008
        ]
      },
      "normal": {
        "vector_tool": [
          0.5159771833205387,
          -0.29182151875569123,
          0.8053618736218676
        ]
      },
      "axis": {
        "vector_tool": [
          0.8566023268078387,
          0.17577963608971303,
          -0.4851123305416642
        ]
      },
      "frame": {
        "origin": [
          0.0821974187326482,
          -0.003091063257343436,
          0.003020717008126008
        ],
        "x_axis": [
          0.8566023268078387,
          0.17577963608971303,
          -0.4851123305416642
        ],
        "y_axis": [
          0.0,
          0.9401817487737623,
          0.3406732734934019
        ],
        "z_axis": [
          0.5159771833205387,
          -0.29182151875569123,
          0.8053618736218676
        ]
      },
      "T_tool_functional": [
        [
          0.8566023268078387,
          0.0,
          0.5159771833205387,
          0.0821974187326482
        ],
        [
          0.17577963608971303,
          0.9401817487737623,
          -0.29182151875569123,
          -0.003091063257343436
        ],
        [
          -0.4851123305416642,
          0.3406732734934019,
          0.8053618736218676,
          0.003020717008126008
        ],
        [
          0.0,
          0.0,
          0.0,
          1.0
        ]
      ],
      "confidence": 0.8909614223188782,
      "source": "p3sam_tool_prior",
      "provenance": {
        "observation_id": "flat_spatula_p3sam_typed_contact_refs",
        "method": "p3sam_face_label_adapter",
        "source_artifact": "artifacts/tool_prior/p3sam/flat_spatula/face_labels/p3sam_face_labels.npy",
        "part_label": 0,
        "patch_id": "x_positive_endpoint",
        "connected_component_index": 0,
        "connected_component_count": 16,
        "original_face_count": 1159,
        "kept_face_count": 1159,
        "removed_disconnected_face_count": 0
      }
    },
    "part_000_y_negative_contact": {
      "role": "contact_patch",
      "center": {
        "xyz_tool": [
          -0.011763596575025471,
          -0.01268409757271258,
          0.0023497134409290604
        ]
      },
      "normal": {
        "vector_tool": [
          -0.004554403918335703,
          -0.9999133545549811,
          -0.012350740364583043
        ]
      },
      "axis": {
        "vector_tool": [
          0.9999896286486918,
          -0.00455405653170157,
          -5.625084370806541e-05
        ]
      },
      "frame": {
        "origin": [
          -0.011763596575025471,
          -0.01268409757271258,
          0.0023497134409290604
        ],
        "x_axis": [
          0.9999896286486918,
          -0.00455405653170157,
          -5.625084370806541e-05
        ],
        "y_axis": [
          0.0,
          -0.012350868459778801,
          0.9999237251152157
        ],
        "z_axis": [
          -0.004554403918335703,
          -0.9999133545549811,
          -0.012350740364583043
        ]
      },
      "T_tool_functional": [
        [
          0.9999896286486918,
          0.0,
          -0.004554403918335703,
          -0.011763596575025471
        ],
        [
          -0.00455405653170157,
          -0.012350868459778801,
          -0.9999133545549811,
          -0.01268409757271258
        ],
        [
          -5.625084370806541e-05,
          0.9999237251152157,
          -0.012350740364583043,
          0.0023497134409290604
        ],
        [
          0.0,
          0.0,
          0.0,
          1.0
        ]
      ],
      "confidence": 0.8909614223188782,
      "source": "p3sam_tool_prior",
      "provenance": {
        "observation_id": "flat_spatula_p3sam_typed_contact_refs",
        "method": "p3sam_face_label_adapter",
        "source_artifact": "artifacts/tool_prior/p3sam/flat_spatula/face_labels/p3sam_face_labels.npy",
        "part_label": 0,
        "patch_id": "y_negative_contact",
        "connected_component_index": 0,
        "connected_component_count": 16,
        "original_face_count": 1159,
        "kept_face_count": 1159,
        "removed_disconnected_face_count": 0
      }
    },
    "part_000_y_positive_contact": {
      "role": "contact_patch",
      "center": {
        "xyz_tool": [
          -0.11494803977120749,
          0.02553203579313626,
          -0.010416461324378484
        ]
      },
      "normal": {
        "vector_tool": [
          0.048730733219680855,
          0.9028879619843739,
          0.4271049563556668
        ]
      },
      "axis": {
        "vector_tool": [
          0.9988119520910191,
          -0.04405072677655785,
          -0.020837894101486266
        ]
      },
      "frame": {
        "origin": [
          -0.11494803977120749,
          0.02553203579313626,
          -0.010416461324378484
        ],
        "x_axis": [
          0.9988119520910191,
          -0.04405072677655785,
          -0.020837894101486266
        ],
        "y_axis": [
          3.469446951953614e-18,
          0.42761298106367257,
          -0.9039619120437759
        ],
        "z_axis": [
          0.048730733219680855,
          0.9028879619843739,
          0.4271049563556668
        ]
      },
      "T_tool_functional": [
        [
          0.9988119520910191,
          3.469446951953614e-18,
          0.048730733219680855,
          -0.11494803977120749
        ],
        [
          -0.04405072677655785,
          0.42761298106367257,
          0.9028879619843739,
          0.02553203579313626
        ],
        [
          -0.020837894101486266,
          -0.9039619120437759,
          0.4271049563556668,
          -0.010416461324378484
        ],
        [
          0.0,
          0.0,
          0.0,
          1.0
        ]
      ],
      "confidence": 0.8909614223188782,
      "source": "p3sam_tool_prior",
      "provenance": {
        "observation_id": "flat_spatula_p3sam_typed_contact_refs",
        "method": "p3sam_face_label_adapter",
        "source_artifact": "artifacts/tool_prior/p3sam/flat_spatula/face_labels/p3sam_face_labels.npy",
        "part_label": 0,
        "patch_id": "y_positive_contact",
        "connected_component_index": 0,
        "connected_component_count": 16,
        "original_face_count": 1159,
        "kept_face_count": 1159,
        "removed_disconnected_face_count": 0
      }
    },
    "part_000_z_negative_contact": {
      "role": "contact_patch",
      "center": {
        "xyz_tool": [
          -0.11472795715441789,
          0.02505280954890411,
          -0.015107049679673737
        ]
      },
      "normal": {
        "vector_tool": [
          -0.08804694883946809,
          -0.4791657462763627,
          -0.8732971558384216
        ]
      },
      "axis": {
        "vector_tool": [
          0.9961163259379198,
          -0.042353569406962804,
          -0.07719093443163841
        ]
      },
      "frame": {
        "origin": [
          -0.11472795715441789,
          0.02505280954890411,
          -0.015107049679673737
        ],
        "x_axis": [
          0.9961163259379198,
          -0.042353569406962804,
          -0.07719093443163841
        ],
        "y_axis": [
          -6.938893903907228e-18,
          -0.8767019805805768,
          0.48103392525485567
        ],
        "z_axis": [
          -0.0880469488394681,
          -0.47916574627636277,
          -0.8732971558384217
        ]
      },
      "T_tool_functional": [
        [
          0.9961163259379198,